{
  "$schema": "https://json-schema.org/draft/2020-12/schema",
  "$id": "https://aiathumanscale.com/schemas/regulatory-source.schema.json",
  "title": "Regulatory Source",
  "type": "object",
  "required": [
    "record_type", "id", "title", "source_type", "authority",
    "jurisdictions", "official_url", "publication_date",
    "legal_status", "retrieved_at"
  ],
  "properties": {
    "record_type": {"const": "regulatory_source"},
    "id": {"$ref": "common.schema.json#/$defs/identifier"},
    "title": {"type": "string", "minLength": 3},
    "source_type": {
      "enum": [
        "statute", "regulation", "proposed_rule", "guidance",
        "enforcement_action", "executive_order", "court_decision",
        "voluntary_standard", "framework", "other"
      ]
    },
    "authority": {"type": "string", "minLength": 2},
    "jurisdictions": {
      "type": "array",
      "minItems": 1,
      "items": {"$ref": "common.schema.json#/$defs/jurisdiction"}
    },
    "official_url": {"$ref": "common.schema.json#/$defs/uri"},
    "navigation_url": {"type": ["string", "null"], "format": "uri"},
    "publication_date": {"$ref": "common.schema.json#/$defs/iso_date"},
    "effective_date": {"type": ["string", "null"], "format": "date"},
    "compliance_date": {"type": ["string", "null"], "format": "date"},
    "comment_deadline": {"type": ["string", "null"], "format": "date"},
    "legal_status": {
      "enum": ["proposed", "final_not_effective", "effective", "superseded", "withdrawn", "nonbinding"]
    },
    "version": {"type": ["string", "null"]},
    "retrieved_at": {"type": "string", "format": "date-time"},
    "content_sha256": {
      "type": ["string", "null"],
      "pattern": "^[a-fA-F0-9]{64}$"
    },
    "notes": {"type": ["string", "null"]}
  },
  "additionalProperties": false
}
